title,price,rating,availability,category,source,rating_num
A Light in the Attic,51.77,Three,In stock,Poetry,Books to Scrape,3
Tipping the Velvet,53.74,One,In stock,Historical Fiction,Books to Scrape,1
Soumission,50.1,One,In stock,Fiction,Books to Scrape,1
Sharp Objects,47.82,Four,In stock,Mystery,Books to Scrape,4
Sapiens: A Brief History of Humankind,54.23,Five,In stock,History,Books to Scrape,5
The Requiem Red,22.65,One,In stock,Young Adult,Books to Scrape,1
The Dirty Little Secrets of Getting Your Dream Job,33.34,Four,In stock,Business,Books to Scrape,4
"The Coming Woman: A Novel Based on the Life of the Infamous Feminist, Victoria Woodhull",17.93,Three,In stock,Default,Books to Scrape,3
The Boys in the Boat: Nine Americans and Their Epic Quest for Gold at the 1936 Berlin Olympics,22.6,Four,In stock,Default,Books to Scrape,4
The Black Maria,52.15,One,In stock,Poetry,Books to Scrape,1
"Starving Hearts (Triangular Trade Trilogy, #1)",13.99,Two,In stock,Default,Books to Scrape,2
Shakespeare's Sonnets,20.66,Four,In stock,Poetry,Books to Scrape,4
Set Me Free,17.46,Five,In stock,Young Adult,Books to Scrape,5
Scott Pilgrim's Precious Little Life (Scott Pilgrim #1),52.29,Five,In stock,Sequential Art,Books to Scrape,5
Rip it Up and Start Again,35.02,Five,In stock,Music,Books to Scrape,5
"Our Band Could Be Your Life: Scenes from the American Indie Underground, 1981-1991",57.25,Three,In stock,Music,Books to Scrape,3
Olio,23.88,One,In stock,Poetry,Books to Scrape,1
Mesaerion: The Best Science Fiction Stories 1800-1849,37.59,One,In stock,Science Fiction,Books to Scrape,1
Libertarianism for Beginners,51.33,Two,In stock,Politics,Books to Scrape,2
It's Only the Himalayas,45.17,Two,In stock,Travel,Books to Scrape,2
In Her Wake,12.84,One,In stock,Thriller,Books to Scrape,1
How Music Works,37.32,Two,In stock,Music,Books to Scrape,2
"Foolproof Preserving: A Guide to Small Batch Jams, Jellies, Pickles, Condiments, and More: A Foolproof Guide to Making Small Batch Jams, Jellies, Pickles, Condiments, and More",30.52,Three,In stock,Food and Drink,Books to Scrape,3
Chase Me (Paris Nights #2),25.27,Five,In stock,Romance,Books to Scrape,5
Black Dust,34.53,Five,In stock,Romance,Books to Scrape,5
Birdsong: A Story in Pictures,54.64,Three,In stock,Childrens,Books to Scrape,3
America's Cradle of Quarterbacks: Western Pennsylvania's Football Factory from Johnny Unitas to Joe Montana,22.5,Three,In stock,Default,Books to Scrape,3
Aladdin and His Wonderful Lamp,53.13,Three,In stock,Default,Books to Scrape,3
Worlds Elsewhere: Journeys Around Shakespeare’s Globe,40.3,Five,In stock,Nonfiction,Books to Scrape,5
Wall and Piece,44.18,Four,In stock,Art,Books to Scrape,4
The Four Agreements: A Practical Guide to Personal Freedom,17.66,Five,In stock,Spirituality,Books to Scrape,5
The Five Love Languages: How to Express Heartfelt Commitment to Your Mate,31.05,Three,In stock,Nonfiction,Books to Scrape,3
The Elephant Tree,23.82,Five,In stock,Thriller,Books to Scrape,5
The Bear and the Piano,36.89,One,In stock,Childrens,Books to Scrape,1
Sophie's World,15.94,Five,In stock,Philosophy,Books to Scrape,5
Penny Maybe,33.29,Three,In stock,Default,Books to Scrape,3
Maude (1883-1993):She Grew Up with the country,18.02,Two,In stock,Default,Books to Scrape,2
"In a Dark, Dark Wood",19.63,One,In stock,Mystery,Books to Scrape,1
Behind Closed Doors,52.22,Four,In stock,Thriller,Books to Scrape,4
You can't bury them all: Poems,33.63,Two,In stock,Poetry,Books to Scrape,2
Slow States of Collapse: Poems,57.31,Three,In stock,Poetry,Books to Scrape,3
Reasons to Stay Alive,26.41,Two,In stock,Nonfiction,Books to Scrape,2
Private Paris (Private #10),47.61,Five,In stock,Fiction,Books to Scrape,5
#HigherSelfie: Wake Up Your Life. Free Your Soul. Find Your Tribe.,23.11,Five,In stock,Nonfiction,Books to Scrape,5
Without Borders (Wanderlove #1),45.07,Two,In stock,New Adult,Books to Scrape,2
When We Collided,31.77,One,In stock,Contemporary,Books to Scrape,1
"We Love You, Charlie Freeman",50.27,Five,In stock,Fiction,Books to Scrape,5
Untitled Collection: Sabbath Poems 2014,14.27,Four,In stock,Poetry,Books to Scrape,4
"Unseen City: The Majesty of Pigeons, the Discreet Charm of Snails & Other Wonders of the Urban Wilderness",44.18,Four,In stock,Nonfiction,Books to Scrape,4
Unicorn Tracks,18.78,Three,In stock,Fantasy,Books to Scrape,3
"Unbound: How Eight Technologies Made Us Human, Transformed Society, and Brought Our World to the Brink",25.52,One,In stock,History,Books to Scrape,1
Tsubasa: WoRLD CHRoNiCLE 2 (Tsubasa WoRLD CHRoNiCLE #2),16.28,One,In stock,Sequential Art,Books to Scrape,1
Throwing Rocks at the Google Bus: How Growth Became the Enemy of Prosperity,31.12,Three,In stock,Nonfiction,Books to Scrape,3
This One Summer,19.49,Four,In stock,Sequential Art,Books to Scrape,4
Thirst,17.27,Five,In stock,Fiction,Books to Scrape,5
The Torch Is Passed: A Harding Family Story,19.09,One,In stock,Add a comment,Books to Scrape,1
The Secret of Dreadwillow Carse,56.13,One,In stock,Childrens,Books to Scrape,1
"The Pioneer Woman Cooks: Dinnertime: Comfort Classics, Freezer Food, 16-Minute Meals, and Other Delicious Ways to Solve Supper!",56.41,One,In stock,Food and Drink,Books to Scrape,1
The Past Never Ends,56.5,Four,In stock,Mystery,Books to Scrape,4
The Natural History of Us (The Fine Art of Pretending #2),45.22,Three,In stock,Young Adult,Books to Scrape,3
The Nameless City (The Nameless City #1),38.16,Four,In stock,Sequential Art,Books to Scrape,4
The Murder That Never Was (Forensic Instincts #5),54.11,Three,In stock,Fiction,Books to Scrape,3
The Most Perfect Thing: Inside (and Outside) a Bird's Egg,42.96,Four,In stock,Science,Books to Scrape,4
"The Mindfulness and Acceptance Workbook for Anxiety: A Guide to Breaking Free from Anxiety, Phobias, and Worry Using Acceptance and Commitment Therapy",23.89,Four,In stock,Add a comment,Books to Scrape,4
The Life-Changing Magic of Tidying Up: The Japanese Art of Decluttering and Organizing,16.77,Three,In stock,Nonfiction,Books to Scrape,3
"The Inefficiency Assassin: Time Management Tactics for Working Smarter, Not Longer",20.59,Five,In stock,Default,Books to Scrape,5
The Gutsy Girl: Escapades for Your Life of Epic Adventure,37.13,One,In stock,Nonfiction,Books to Scrape,1
The Electric Pencil: Drawings from Inside State Hospital No. 3,56.06,One,In stock,Nonfiction,Books to Scrape,1
The Death of Humanity: and the Case for Life,58.11,Four,In stock,Philosophy,Books to Scrape,4
"The Bulletproof Diet: Lose up to a Pound a Day, Reclaim Energy and Focus, Upgrade Your Life",49.05,Three,In stock,Health,Books to Scrape,3
The Art Forger,40.76,Three,In stock,Add a comment,Books to Scrape,3
The Age of Genius: The Seventeenth Century and the Birth of the Modern Mind,19.73,One,In stock,History,Books to Scrape,1
The Activist's Tao Te Ching: Ancient Advice for a Modern Revolution,32.24,Five,In stock,Spirituality,Books to Scrape,5
Spark Joy: An Illustrated Master Class on the Art of Organizing and Tidying Up,41.83,Four,In stock,Nonfiction,Books to Scrape,4
Soul Reader,39.58,Two,In stock,Default,Books to Scrape,2
Security,39.25,Two,In stock,Horror,Books to Scrape,2
"Saga, Volume 6 (Saga (Collected Editions) #6)",25.02,Three,In stock,Fantasy,Books to Scrape,3
"Saga, Volume 5 (Saga (Collected Editions) #5)",51.04,Two,In stock,Sequential Art,Books to Scrape,2
Reskilling America: Learning to Labor in the Twenty-First Century,19.83,Two,In stock,Nonfiction,Books to Scrape,2
"Rat Queens, Vol. 3: Demons (Rat Queens (Collected Editions) #11-15)",50.4,Three,In stock,Sequential Art,Books to Scrape,3
"Princess Jellyfish 2-in-1 Omnibus, Vol. 01 (Princess Jellyfish 2-in-1 Omnibus #1)",13.61,Five,In stock,Sequential Art,Books to Scrape,5
Princess Between Worlds (Wide-Awake Princess #5),13.34,Five,In stock,Fantasy,Books to Scrape,5
"Pop Gun War, Volume 1: Gift",18.97,One,In stock,Sequential Art,Books to Scrape,1
"Political Suicide: Missteps, Peccadilloes, Bad Calls, Backroom Hijinx, Sordid Pasts, Rotten Breaks, and Just Plain Dumb Mistakes in the Annals of American Politics",36.28,Two,In stock,History,Books to Scrape,2
Patience,10.16,Three,In stock,Sequential Art,Books to Scrape,3
"Outcast, Vol. 1: A Darkness Surrounds Him (Outcast #1)",15.44,Four,In stock,Sequential Art,Books to Scrape,4
orange: The Complete Collection 1 (orange: The Complete Collection #1),48.41,One,In stock,Sequential Art,Books to Scrape,1
Online Marketing for Busy Authors: A Step-By-Step Guide,46.35,One,In stock,Self Help,Books to Scrape,1
On a Midnight Clear,14.07,Three,In stock,Add a comment,Books to Scrape,3
Obsidian (Lux #1),14.86,Two,In stock,Young Adult,Books to Scrape,2
My Paris Kitchen: Recipes and Stories,33.37,Two,In stock,Food and Drink,Books to Scrape,2
Masks and Shadows,56.4,Two,In stock,Fantasy,Books to Scrape,2
"Mama Tried: Traditional Italian Cooking for the Screwed, Crude, Vegan, and Tattooed",14.02,Four,In stock,Food and Drink,Books to Scrape,4
"Lumberjanes, Vol. 2: Friendship to the Max (Lumberjanes #5-8)",46.91,Two,In stock,Sequential Art,Books to Scrape,2
"Lumberjanes, Vol. 1: Beware the Kitten Holy (Lumberjanes #1-4)",45.61,Three,In stock,Sequential Art,Books to Scrape,3
Lumberjanes Vol. 3: A Terrible Plan (Lumberjanes #9-12),19.92,Two,In stock,Sequential Art,Books to Scrape,2
"Layered: Baking, Building, and Styling Spectacular Cakes",40.11,One,In stock,Food and Drink,Books to Scrape,1
Judo: Seven Steps to Black Belt (an Introductory Guide for Beginners),53.9,Two,In stock,Add a comment,Books to Scrape,2
Join,35.67,Five,In stock,Science Fiction,Books to Scrape,5
In the Country We Love: My Family Divided,22.0,Four,In stock,Nonfiction,Books to Scrape,4
Immunity: How Elie Metchnikoff Changed the Course of Modern Medicine,57.36,Five,In stock,Science,Books to Scrape,5
"I Hate Fairyland, Vol. 1: Madly Ever After (I Hate Fairyland (Compilations) #1-5)",29.17,Two,In stock,Sequential Art,Books to Scrape,2
I am a Hero Omnibus Volume 1,54.63,Three,In stock,Sequential Art,Books to Scrape,3
How to Be Miserable: 40 Strategies You Already Use,46.03,One,In stock,Self Help,Books to Scrape,1
Her Backup Boyfriend (The Sorensen Family #1),33.97,One,In stock,Romance,Books to Scrape,1
"Giant Days, Vol. 2 (Giant Days #5-8)",22.11,Two,In stock,Sequential Art,Books to Scrape,2
Forever and Forever: The Courtship of Henry Longfellow and Fanny Appleton,29.69,Three,In stock,Historical Fiction,Books to Scrape,3
First and First (Five Boroughs #3),15.97,Four,In stock,Romance,Books to Scrape,4
Fifty Shades Darker (Fifty Shades #2),21.96,One,In stock,Romance,Books to Scrape,1
Everydata: The Misinformation Hidden in the Little Data You Consume Every Day,54.35,Two,In stock,Nonfiction,Books to Scrape,2
"Don't Be a Jerk: And Other Practical Advice from Dogen, Japan's Greatest Zen Master",37.97,Two,In stock,Religion,Books to Scrape,2
Danganronpa Volume 1,51.99,Four,In stock,Sequential Art,Books to Scrape,4
Crown of Midnight (Throne of Glass #2),43.29,Three,In stock,Fantasy,Books to Scrape,3
"Codename Baboushka, Volume 1: The Conclave of Death",36.72,Four,In stock,Sequential Art,Books to Scrape,4
Camp Midnight,17.08,Four,In stock,Sequential Art,Books to Scrape,4
Call the Nurse: True Stories of a Country Nurse on a Scottish Isle,29.14,Five,In stock,Nonfiction,Books to Scrape,5
Burning,28.81,Three,In stock,Young Adult,Books to Scrape,3
Bossypants,49.46,Two,In stock,Default,Books to Scrape,2
"Bitch Planet, Vol. 1: Extraordinary Machine (Bitch Planet (Collected Editions))",37.92,Two,In stock,Sequential Art,Books to Scrape,2
"Avatar: The Last Airbender: Smoke and Shadow, Part 3 (Smoke and Shadow #3)",28.09,Two,In stock,Fantasy,Books to Scrape,2
Algorithms to Live By: The Computer Science of Human Decisions,30.81,One,In stock,Nonfiction,Books to Scrape,1
A World of Flavor: Your Gluten Free Passport,42.95,One,In stock,Default,Books to Scrape,1
"A Piece of Sky, a Grain of Rice: A Memoir in Four Meditations",56.76,Five,In stock,Default,Books to Scrape,5
A Murder in Time,16.64,One,In stock,Mystery,Books to Scrape,1
A Flight of Arrows (The Pathfinders #2),55.53,Five,In stock,Historical Fiction,Books to Scrape,5
A Fierce and Subtle Poison,28.13,Four,In stock,Young Adult,Books to Scrape,4
A Court of Thorns and Roses (A Court of Thorns and Roses #1),52.37,One,In stock,Fantasy,Books to Scrape,1
(Un)Qualified: How God Uses Broken People to Do Big Things,54.0,Five,In stock,Christian,Books to Scrape,5
You Are What You Love: The Spiritual Power of Habit,21.87,Four,In stock,Religion,Books to Scrape,4
"William Shakespeare's Star Wars: Verily, A New Hope (William Shakespeare's Star Wars #4)",43.3,Four,In stock,Science Fiction,Books to Scrape,4
Tuesday Nights in 1980,21.04,Two,In stock,Fiction,Books to Scrape,2
Tracing Numbers on a Train,41.6,Three,In stock,Default,Books to Scrape,3
Throne of Glass (Throne of Glass #1),35.07,Three,In stock,Fantasy,Books to Scrape,3
Thomas Jefferson and the Tripoli Pirates: The Forgotten War That Changed American History,59.64,One,In stock,History,Books to Scrape,1
Thirteen Reasons Why,52.72,One,In stock,Default,Books to Scrape,1
The White Cat and the Monk: A Retelling of the Poem “Pangur Bán”,58.08,Four,In stock,Childrens,Books to Scrape,4
The Wedding Dress,24.12,One,In stock,Romance,Books to Scrape,1
The Vacationers,42.15,Four,In stock,Fiction,Books to Scrape,4
The Third Wave: An Entrepreneur’s Vision of the Future,12.61,Five,In stock,Business,Books to Scrape,5
The Stranger,17.44,Four,In stock,Philosophy,Books to Scrape,4
The Shadow Hero (The Shadow Hero),33.14,One,In stock,Sequential Art,Books to Scrape,1
The Secret (The Secret #1),27.37,Four,In stock,Default,Books to Scrape,4
The Regional Office Is Under Attack!,51.36,Five,In stock,Fiction,Books to Scrape,5
The Psychopath Test: A Journey Through the Madness Industry,36.0,Two,In stock,Default,Books to Scrape,2
The Project,10.65,One,In stock,Science Fiction,Books to Scrape,1
The Power of Now: A Guide to Spiritual Enlightenment,43.54,Two,In stock,Nonfiction,Books to Scrape,2
The Omnivore's Dilemma: A Natural History of Four Meals,38.21,Two,In stock,Nonfiction,Books to Scrape,2
The Nerdy Nummies Cookbook: Sweet Treats for the Geek in All of Us,37.34,Five,In stock,Food and Drink,Books to Scrape,5
The Murder of Roger Ackroyd (Hercule Poirot #4),44.1,Four,In stock,Mystery,Books to Scrape,4
The Mistake (Off-Campus #2),43.29,Three,In stock,New Adult,Books to Scrape,3
The Matchmaker's Playbook (Wingmen Inc. #1),55.85,One,In stock,New Adult,Books to Scrape,1
The Love and Lemons Cookbook: An Apple-to-Zucchini Celebration of Impromptu Cooking,37.6,Two,In stock,Food and Drink,Books to Scrape,2
The Long Shadow of Small Ghosts: Murder and Memory in an American City,10.97,One,In stock,Crime,Books to Scrape,1
The Kite Runner,41.82,Four,In stock,Default,Books to Scrape,4
The House by the Lake,36.95,One,In stock,Historical Fiction,Books to Scrape,1
The Glittering Court (The Glittering Court #1),44.28,One,In stock,Fantasy,Books to Scrape,1
The Girl on the Train,55.02,Two,In stock,Default,Books to Scrape,2
The Genius of Birds,17.24,One,In stock,Nonfiction,Books to Scrape,1
The Emerald Mystery,23.15,Two,In stock,Default,Books to Scrape,2
The Cookies & Cups Cookbook: 125+ sweet & savory recipes reminding you to Always Eat Dessert First,41.25,One,In stock,Food and Drink,Books to Scrape,1
The Bridge to Consciousness: I'm Writing the Bridge Between Science and Our Old and New Beliefs.,32.0,Three,In stock,Default,Books to Scrape,3
The Artist's Way: A Spiritual Path to Higher Creativity,38.49,Five,In stock,Nonfiction,Books to Scrape,5
The Art of War,33.34,Five,In stock,Default,Books to Scrape,5
The Argonauts,10.93,Two,In stock,Autobiography,Books to Scrape,2
The 10% Entrepreneur: Live Your Startup Dream Without Quitting Your Day Job,27.55,Three,In stock,Business,Books to Scrape,3
Suddenly in Love (Lake Haven #1),55.99,Two,In stock,Romance,Books to Scrape,2
Something More Than This,16.24,Four,In stock,Romance,Books to Scrape,4
Soft Apocalypse,26.12,Two,In stock,Science Fiction,Books to Scrape,2
So You've Been Publicly Shamed,12.23,Two,In stock,Nonfiction,Books to Scrape,2
Shoe Dog: A Memoir by the Creator of NIKE,23.99,Two,In stock,Business,Books to Scrape,2
"Shobu Samurai, Project Aryoku (#3)",29.06,Three,In stock,Add a comment,Books to Scrape,3
Secrets and Lace (Fatal Hearts #1),20.27,One,In stock,Default,Books to Scrape,1
Scarlett Epstein Hates It Here,43.55,Five,In stock,Young Adult,Books to Scrape,5
Romero and Juliet: A Tragic Tale of Love and Zombies,36.94,One,In stock,Default,Books to Scrape,1
Redeeming Love,20.47,Five,In stock,Christian Fiction,Books to Scrape,5
Poses for Artists Volume 1 - Dynamic and Sitting Poses: An Essential Reference for Figure Drawing and the Human Form,41.06,One,In stock,Default,Books to Scrape,1
Poems That Make Grown Women Cry,14.19,Four,In stock,Poetry,Books to Scrape,4
"Nightingale, Sing",38.28,One,In stock,Young Adult,Books to Scrape,1
Night Sky with Exit Wounds,41.05,One,In stock,Poetry,Books to Scrape,1
Mrs. Houdini,30.25,Five,In stock,Historical Fiction,Books to Scrape,5
Modern Romance,28.26,Five,In stock,Add a comment,Books to Scrape,5
Miss Peregrine’s Home for Peculiar Children (Miss Peregrine’s Peculiar Children #1),10.76,One,In stock,Default,Books to Scrape,1
Louisa: The Extraordinary Life of Mrs. Adams,16.85,Two,In stock,Biography,Books to Scrape,2
Little Red,13.47,Three,In stock,Childrens,Books to Scrape,3
Library of Souls (Miss Peregrine’s Peculiar Children #3),48.56,Five,In stock,Young Adult,Books to Scrape,5
Large Print Heart of the Pride,19.15,Two,In stock,Default,Books to Scrape,2
I Had a Nice Time And Other Lies...: How to find love & sh*t like that,57.36,Four,In stock,Womens Fiction,Books to Scrape,4
Hollow City (Miss Peregrine’s Peculiar Children #2),42.98,One,In stock,Fantasy,Books to Scrape,1
Grumbles,22.16,Two,In stock,Default,Books to Scrape,2
Full Moon over Noah’s Ark: An Odyssey to Mount Ararat and Beyond,49.43,Four,In stock,Travel,Books to Scrape,4
Frostbite (Vampire Academy #2),29.99,Five,In stock,Young Adult,Books to Scrape,5
Follow You Home,21.36,One,In stock,Horror,Books to Scrape,1
First Steps for New Christians (Print Edition),29.0,One,In stock,Default,Books to Scrape,1
Finders Keepers (Bill Hodges Trilogy #2),53.53,Five,In stock,Fiction,Books to Scrape,5
"Fables, Vol. 1: Legends in Exile (Fables #1)",41.62,Four,In stock,Sequential Art,Books to Scrape,4
Eureka Trivia 6.0,54.59,Four,In stock,Default,Books to Scrape,4
Drive: The Surprising Truth About What Motivates Us,34.95,Four,In stock,Default,Books to Scrape,4
Done Rubbed Out (Reightman & Bailey #1),37.72,Five,In stock,Default,Books to Scrape,5
Doing It Over (Most Likely To #1),35.61,Three,In stock,Romance,Books to Scrape,3
"Deliciously Ella Every Day: Quick and Easy Recipes for Gluten-Free Snacks, Packed Lunches, and Simple Meals",42.16,Three,In stock,Food and Drink,Books to Scrape,3
Dark Notes,19.19,Five,In stock,Erotica,Books to Scrape,5
"Daring Greatly: How the Courage to Be Vulnerable Transforms the Way We Live, Love, Parent, and Lead",19.43,Three,In stock,Nonfiction,Books to Scrape,3
Close to You,49.46,Four,In stock,Christian Fiction,Books to Scrape,4
Chasing Heaven: What Dying Taught Me About Living,37.8,Two,In stock,Spirituality,Books to Scrape,2
Big Magic: Creative Living Beyond Fear,30.8,Three,In stock,Nonfiction,Books to Scrape,3
Becoming Wise: An Inquiry into the Mystery and Art of Living,27.43,Two,In stock,Nonfiction,Books to Scrape,2
Beauty Restored (Riley Family Legacy Novellas #3),11.11,Two,In stock,Default,Books to Scrape,2
Batman: The Long Halloween (Batman),36.5,Two,In stock,Sequential Art,Books to Scrape,2
Batman: The Dark Knight Returns (Batman),15.38,Five,In stock,Sequential Art,Books to Scrape,5
Ayumi's Violin,15.48,Two,In stock,Default,Books to Scrape,2
Anonymous,46.82,Four,In stock,Default,Books to Scrape,4
Amy Meets the Saints and Sages,18.46,Three,In stock,Default,Books to Scrape,3
Amid the Chaos,36.58,One,In stock,Cultural,Books to Scrape,1
Amatus,50.54,Five,In stock,Default,Books to Scrape,5
Agnostic: A Spirited Manifesto,12.51,Five,In stock,Nonfiction,Books to Scrape,5
Zealot: The Life and Times of Jesus of Nazareth,24.7,Three,In stock,History,Books to Scrape,3
You (You #1),43.61,Five,In stock,Thriller,Books to Scrape,5
"Wonder Woman: Earth One, Volume One (Wonder Woman: Earth One #1)",37.34,Four,In stock,Sequential Art,Books to Scrape,4
Wild Swans,14.36,Two,In stock,Young Adult,Books to Scrape,2
Why the Right Went Wrong: Conservatism--From Goldwater to the Tea Party and Beyond,52.65,Four,In stock,Politics,Books to Scrape,4
Whole Lotta Creativity Going On: 60 Fun and Unusual Exercises to Awaken and Strengthen Your Creativity,38.2,Four,In stock,Nonfiction,Books to Scrape,4
What's It Like in Space?: Stories from Astronauts Who've Been There,19.6,Two,In stock,Nonfiction,Books to Scrape,2
"We Are Robin, Vol. 1: The Vigilante Business (We Are Robin #1)",53.9,One,In stock,Sequential Art,Books to Scrape,1
Walt Disney's Alice in Wonderland,12.96,Five,In stock,Childrens,Books to Scrape,5
V for Vendetta (V for Vendetta Complete),37.1,Four,In stock,Default,Books to Scrape,4
Until Friday Night (The Field Party #1),46.31,Two,In stock,Young Adult,Books to Scrape,2
"Unbroken: A World War II Story of Survival, Resilience, and Redemption",45.95,Two,In stock,Default,Books to Scrape,2
Twenty Yawns,22.08,Two,In stock,Childrens,Books to Scrape,2
Through the Woods,25.38,Two,In stock,Sequential Art,Books to Scrape,2
This Is Where It Ends,27.12,Two,In stock,Young Adult,Books to Scrape,2
The Year of Magical Thinking,43.04,Two,In stock,Nonfiction,Books to Scrape,2
The Wright Brothers,56.8,Four,In stock,Default,Books to Scrape,4
The White Queen (The Cousins' War #1),25.91,Five,In stock,Add a comment,Books to Scrape,5
The Wedding Pact (The O'Malleys #2),32.61,Three,In stock,Romance,Books to Scrape,3
The Time Keeper,27.88,Five,In stock,Fiction,Books to Scrape,5
The Testament of Mary,52.67,Four,In stock,Fiction,Books to Scrape,4
The Star-Touched Queen,46.02,Five,In stock,Fantasy,Books to Scrape,5
The Songs of the Gods,44.48,Five,In stock,Default,Books to Scrape,5
The Song of Achilles,37.4,Five,In stock,Add a comment,Books to Scrape,5
The Rosie Project (Don Tillman #1),54.04,One,In stock,Default,Books to Scrape,1
The Power of Habit: Why We Do What We Do in Life and Business,16.88,Three,In stock,Default,Books to Scrape,3
The Marriage of Opposites,28.08,Four,In stock,Historical Fiction,Books to Scrape,4
The Lucifer Effect: Understanding How Good People Turn Evil,10.4,One,In stock,Psychology,Books to Scrape,1
The Long Haul (Diary of a Wimpy Kid #9),44.07,One,In stock,Humor,Books to Scrape,1
The Loney,23.4,One,In stock,Horror,Books to Scrape,1
The Literature Book (Big Ideas Simply Explained),17.43,Three,In stock,Nonfiction,Books to Scrape,3
The Last Mile (Amos Decker #2),54.21,Two,In stock,Mystery,Books to Scrape,2
The Immortal Life of Henrietta Lacks,40.67,Two,In stock,Add a comment,Books to Scrape,2
The Hidden Oracle (The Trials of Apollo #1),52.26,Two,In stock,Fantasy,Books to Scrape,2
The Help Yourself Cookbook for Kids: 60 Easy Plant-Based Recipes Kids Can Make to Stay Healthy and Save the Earth,28.77,Three,In stock,Food and Drink,Books to Scrape,3
The Guilty (Will Robie #4),13.82,Two,In stock,Thriller,Books to Scrape,2
The First Hostage (J.B. Collins #2),25.85,Three,In stock,Fiction,Books to Scrape,3
The Dovekeepers,48.78,One,In stock,Add a comment,Books to Scrape,1
The Darkest Lie,35.35,Five,In stock,Young Adult,Books to Scrape,5
The Bane Chronicles (The Bane Chronicles #1-11),44.73,Four,In stock,Fantasy,Books to Scrape,4
The Bad-Ass Librarians of Timbuktu: And Their Race to Save the World’s Most Precious Manuscripts,15.77,One,In stock,Nonfiction,Books to Scrape,1
The 14th Colony (Cotton Malone #11),39.24,One,In stock,Thriller,Books to Scrape,1
That Darkness (Gardiner and Renner #1),13.92,One,In stock,Mystery,Books to Scrape,1
Tastes Like Fear (DI Marnie Rome #3),10.69,One,In stock,Mystery,Books to Scrape,1
Take Me with You,45.21,Three,In stock,Fiction,Books to Scrape,3
Swell: A Year of Waves,45.58,One,In stock,Nonfiction,Books to Scrape,1
Superman Vol. 1: Before Truth (Superman by Gene Luen Yang #1),11.89,Five,In stock,Sequential Art,Books to Scrape,5
Still Life with Bread Crumbs,26.41,Three,In stock,Fiction,Books to Scrape,3
Steve Jobs,39.5,Five,In stock,Default,Books to Scrape,5
Sorting the Beef from the Bull: The Science of Food Fraud Forensics,44.74,Four,In stock,Science,Books to Scrape,4
Someone Like You (The Harrisons #2),52.79,Five,In stock,Contemporary,Books to Scrape,5
"So Cute It Hurts!!, Vol. 6 (So Cute It Hurts!! #6)",35.43,Four,In stock,Sequential Art,Books to Scrape,4
Shtum,55.84,Four,In stock,Fiction,Books to Scrape,4
See America: A Celebration of Our National Parks & Treasured Sites,48.87,Three,In stock,Travel,Books to Scrape,3
salt.,46.78,Four,In stock,Poetry,Books to Scrape,4
Robin War,47.82,Three,In stock,Sequential Art,Books to Scrape,3
"Red Hood/Arsenal, Vol. 1: Open for Business (Red Hood/Arsenal #1)",25.48,Two,In stock,Sequential Art,Books to Scrape,2
Rain Fish,23.57,Three,In stock,Childrens,Books to Scrape,3
"Quarter Life Poetry: Poems for the Young, Broke and Hangry",50.89,Five,In stock,Poetry,Books to Scrape,5
Pet Sematary,10.56,Three,In stock,Horror,Books to Scrape,3
"Overload: How to Unplug, Unwind, and Unleash Yourself from the Pressure of Stress",52.15,Three,In stock,Self Help,Books to Scrape,3
Once Was a Time,18.28,Two,In stock,Childrens,Books to Scrape,2
Old School (Diary of a Wimpy Kid #10),11.83,Five,In stock,Humor,Books to Scrape,5
No Dream Is Too High: Life Lessons From a Man Who Walked on the Moon,21.95,Two,In stock,Nonfiction,Books to Scrape,2
"Naruto (3-in-1 Edition), Vol. 14: Includes Vols. 40, 41 & 42 (Naruto: Omnibus #14)",38.39,Two,In stock,Sequential Art,Books to Scrape,2
My Name Is Lucy Barton,41.56,One,In stock,Fiction,Books to Scrape,1
My Mrs. Brown,24.48,Three,In stock,Fiction,Books to Scrape,3
